{
  "schemaType": "nansen.method",
  "schemaVersion": "0.1.0",
  "id": "ophys.setup_variables",
  "version": "1.0.0",
  "title": "Set up two-photon variables",
  "category": "Two-photon/Setup",
  "entityType": "@project",
  "description": "Adds the data variables the ophys methods read and write, for an entity type, in a data location: .npy arrays and a .json ROI file in a subfolder of each entity's folder. With rawFilePattern, TwoPhotonSeries_Original reads the raw recording through that file pattern. Variables that exist are left alone. Also adds the ophys.imaging and ophys.image_stats columns to the entity type.",
  "implementations": {
    "python": "ophys_methods:setup_variables",
    "matlab": "ophys.setupVariables"
  },
  "options": {
    "type": "object",
    "properties": {
      "entityType": {
        "type": "string",
        "default": "session",
        "title": "Entity type"
      },
      "dataLocation": {
        "type": "string",
        "default": "processed",
        "title": "Data location",
        "description": "Where processed data is written"
      },
      "subfolder": {
        "type": "string",
        "default": "ophys",
        "title": "Subfolder",
        "description": "Folder inside each entity's folder"
      },
      "rawDataLocation": {
        "type": "string",
        "default": "raw",
        "title": "Raw data location"
      },
      "rawFilePattern": {
        "type": "string",
        "default": "",
        "title": "Raw file pattern",
        "description": "Name of the DSM file pattern that finds the recording. Leave empty to not add TwoPhotonSeries_Original."
      },
      "rawFileAdapter": {
        "type": "string",
        "default": "ophys.sciscan_raw",
        "title": "Raw file adapter"
      },
      "addColumns": {
        "type": "boolean",
        "default": true,
        "title": "Add the imaging and image statistics columns"
      }
    }
  }
}
