{
  "schemaType": "nansen.method",
  "schemaVersion": "0.1.0",
  "id": "ophys.deep_interpolation",
  "version": "1.0.0",
  "title": "Denoise stack (DeepInterpolation)",
  "category": "Two-photon/Image processing",
  "entityType": "*",
  "description": "Removes independent noise with DeepInterpolation (Lecoq et al. 2021), as dev's Denoiser does: in Python with the deepinterpolation package and h5py, in MATLAB with DeepInterpolation-MATLAB and the Deep Learning Toolbox, when installed. Each frame is predicted from the frames around it by a trained network, given as modelPath (an .h5 model, such as the Allen Institute's pretrained two-photon models; in MATLAB also a .mat file with a network as net). Frames too close to the start or end to be predicted are kept as they were.",
  "implementations": {
    "python": "ophys_methods:deep_interpolation",
    "matlab": "ophys.deepInterpolation"
  },
  "options": {
    "type": "object",
    "properties": {
      "stack": {
        "type": "string",
        "default": "TwoPhotonSeries_Corrected",
        "title": "Stack",
        "description": "Variable that holds the image stack (height x width x frames)."
      },
      "output": {
        "type": "string",
        "default": "TwoPhotonSeries_Denoised",
        "title": "Denoised stack",
        "description": "Variable the result is saved to."
      },
      "modelPath": {
        "type": "string",
        "default": "",
        "title": "Model file",
        "description": "Path of the trained model (.h5; in MATLAB also .mat, the network saved as net)"
      },
      "preFrames": {
        "type": "integer",
        "default": 30,
        "minimum": 1,
        "title": "Frames before"
      },
      "postFrames": {
        "type": "integer",
        "default": 30,
        "minimum": 1,
        "title": "Frames after"
      },
      "omittedFrames": {
        "type": "integer",
        "default": 0,
        "minimum": 0,
        "maximum": 4,
        "title": "Frames left out next to the predicted one"
      },
      "firstFrame": {
        "type": "integer",
        "default": 1,
        "minimum": 1,
        "title": "First frame",
        "description": "The first frame to process, from 1 (dev's frame interval): the method works on frames firstFrame..lastFrame only, and its outputs have that many frames."
      },
      "lastFrame": {
        "type": "integer",
        "default": 0,
        "minimum": 0,
        "title": "Last frame",
        "description": "The last frame to process; 0 for the last frame of the stack."
      }
    }
  }
}
