{
  "schemaType": "nansen.method",
  "schemaVersion": "0.1.0",
  "id": "ophys.image_stats",
  "version": "1.0.0",
  "title": "Image statistics",
  "category": "Two-photon/Inspect",
  "entityType": "*",
  "description": "Size and intensity of the entity's image stack, with its average and maximum projections saved as images. Fills the ophys.image_stats columns.",
  "implementations": {
    "python": "ophys_methods:image_stats",
    "matlab": "ophys.imageStats"
  },
  "options": {
    "type": "object",
    "properties": {
      "stack": {
        "type": "string",
        "default": "TwoPhotonSeries_Corrected",
        "title": "Stack",
        "description": "Variable that holds the image stack (height x width x frames)."
      },
      "averageOutput": {
        "type": "string",
        "default": "FovAverageProjection",
        "title": "Average projection",
        "description": "Variable the average over frames is saved to. Leave empty to not save it."
      },
      "maximumOutput": {
        "type": "string",
        "default": "FovMaximumProjection",
        "title": "Maximum projection",
        "description": "Variable the maximum over frames is saved to. Leave empty to not save it."
      },
      "frameStatsOutput": {
        "type": "string",
        "default": "FrameStats",
        "title": "Frame statistics",
        "description": "Variable each frame's mean, minimum, maximum and standard deviation (frames x 4) is saved to. Leave empty to not save it."
      },
      "firstFrame": {
        "type": "integer",
        "default": 1,
        "minimum": 1,
        "title": "First frame",
        "description": "The first frame to process, from 1 (dev's frame interval): the method works on frames firstFrame..lastFrame only, and its outputs have that many frames."
      },
      "lastFrame": {
        "type": "integer",
        "default": 0,
        "minimum": 0,
        "title": "Last frame",
        "description": "The last frame to process; 0 for the last frame of the stack."
      },
      "channel": {
        "type": "integer",
        "default": 1,
        "minimum": 1,
        "title": "Channel",
        "description": "Of a stack with channels (height x width x channels x frames): the one to use, from 1"
      },
      "plane": {
        "type": "integer",
        "default": 1,
        "minimum": 0,
        "title": "Plane",
        "description": "Of a stack with planes (height x width x channels x planes x frames): the one to use, from 1, or 0 for every plane, one after the other, in one run"
      }
    }
  }
}
