{
  "schemaType": "nansen.method",
  "schemaVersion": "0.1.0",
  "id": "ophys.normcorre",
  "version": "1.0.0",
  "title": "Correct motion (NoRMCorre)",
  "category": "Two-photon/Motion correction",
  "entityType": "*",
  "description": "Runs NoRMCorre on the stack: in MATLAB NoRMCorre itself, when it is on the MATLAB path; in Python CaImAn's port of it (caiman.motion_correction.MotionCorrect), when CaImAn is installed. Rigid with gridSize 0 (or patches 1), piecewise rigid otherwise. Its options are passed to NoRMCorre under NoRMCorre's names (given in each option's description), and to CaImAn under CaImAn's: max_shifts, strides (the grid), overlaps and max_deviation_rigid; CaImAn registers chunks of binWidth frames to one template, renewed between passes (with updateTemplate), and finds shifts to 1/10 pixel whatever the upsampling. Saves the aligned stack and the shifts of each frame (frames x 2, subpixel) in the same variables in both languages; the two tools' results are close, not the same. Presets nonrigid and rigid are dev's NoRMCorre presets.",
  "implementations": {
    "python": "ophys_methods:normcorre",
    "matlab": "ophys.normcorre"
  },
  "options": {
    "type": "object",
    "properties": {
      "stack": {
        "type": "string",
        "default": "TwoPhotonSeries_Original",
        "title": "Stack",
        "description": "Variable that holds the image stack (height x width x frames)."
      },
      "output": {
        "type": "string",
        "default": "TwoPhotonSeries_Corrected",
        "title": "Aligned stack",
        "description": "Variable the result is saved to."
      },
      "shiftsOutput": {
        "type": "string",
        "default": "MotionCorrectionShifts",
        "title": "Shifts",
        "description": "Variable the shifts are saved to. Leave empty to not save it."
      },
      "maxShift": {
        "type": "integer",
        "default": 20,
        "minimum": 1,
        "title": "Largest shift (px)",
        "description": "NoRMCorre's max_shift"
      },
      "patches": {
        "type": "integer",
        "default": 0,
        "minimum": 0,
        "title": "Patches per side",
        "description": "dev's numRows and numCols: when above 0, the frame is cut into this many patches down and across (a patch is round(height / patches) x round(width / patches) pixels); 1 is rigid. 0 uses gridSize"
      },
      "gridSize": {
        "type": "integer",
        "default": 0,
        "minimum": 0,
        "title": "Patch size (px)",
        "description": "NoRMCorre's grid_size, the size of a patch (without its overlap); 0 for rigid correction. Not used when patches is above 0"
      },
      "upsampling": {
        "type": "integer",
        "default": 50,
        "minimum": 1,
        "title": "Upsampling factor",
        "description": "NoRMCorre's us_fac: shifts are found to 1 / this of a pixel"
      },
      "maxDeviation": {
        "type": "integer",
        "default": 3,
        "minimum": 0,
        "title": "Largest patch deviation (px)",
        "description": "NoRMCorre's max_dev: how far a patch's shift may be from the frame's"
      },
      "overlap": {
        "type": "integer",
        "default": 32,
        "minimum": 0,
        "title": "Patch overlap (px)",
        "description": "NoRMCorre's overlap_pre"
      },
      "iterations": {
        "type": "integer",
        "default": 1,
        "minimum": 1,
        "title": "Passes",
        "description": "NoRMCorre's iter: passes over the recording"
      },
      "updateTemplate": {
        "type": "boolean",
        "default": true,
        "title": "Update the template",
        "description": "NoRMCorre's upd_template: the template follows the aligned frames"
      },
      "initialBatchSize": {
        "type": "integer",
        "default": 100,
        "minimum": 1,
        "title": "Frames of the first template",
        "description": "NoRMCorre's init_batch"
      },
      "binWidth": {
        "type": "integer",
        "default": 200,
        "minimum": 1,
        "title": "Frames per template update",
        "description": "NoRMCorre's bin_width"
      },
      "firstFrame": {
        "type": "integer",
        "default": 1,
        "minimum": 1,
        "title": "First frame",
        "description": "The first frame to process, from 1 (dev's frame interval): the method works on frames firstFrame..lastFrame only, and its outputs have that many frames."
      },
      "lastFrame": {
        "type": "integer",
        "default": 0,
        "minimum": 0,
        "title": "Last frame",
        "description": "The last frame to process; 0 for the last frame of the stack."
      },
      "channel": {
        "type": "integer",
        "default": 1,
        "minimum": 1,
        "title": "Channel",
        "description": "Of a stack with channels (height x width x channels x frames): the one to use, from 1"
      },
      "plane": {
        "type": "integer",
        "default": 1,
        "minimum": 1,
        "title": "Plane",
        "description": "Of a stack with planes (height x width x channels x planes x frames): the one to use, from 1"
      }
    }
  }
}
