{
  "schemaType": "nansen.method",
  "schemaVersion": "0.1.0",
  "id": "ophys.quicky",
  "version": "1.0.0",
  "title": "Detect ROIs (Quicky)",
  "category": "Two-photon/Segmentation",
  "entityType": "*",
  "description": "dev's Quicky (flufinder) detection, natively in both languages: frames are binned by their maximum, the smooth and slow background taken out, each bin thresholded at a percentile and cleaned with disk-shaped morphology, and the places where the thresholded areas come back in at least observationsRequired bins become ROIs. With shape detection, somata are also found by their shape in the mean image: a ring template is correlated with it, and each candidate's mask is found by where the image rises and falls along 48 directions from its centre. Saved as ophys.detect_rois saves them. Areas are compared deterministically (by centroids within 3 px of their median), where flufinder clusters them, and shape detection follows flufinder's steps at the image's own resolution; ophys.flufinder runs flufinder itself.",
  "implementations": {
    "python": "ophys_methods:quicky",
    "matlab": "ophys.quicky"
  },
  "options": {
    "type": "object",
    "properties": {
      "stack": {
        "type": "string",
        "default": "TwoPhotonSeries_Corrected",
        "title": "Stack",
        "description": "Variable that holds the image stack (height x width x frames)."
      },
      "output": {
        "type": "string",
        "default": "RoiArray",
        "title": "ROIs",
        "description": "Variable the result is saved to."
      },
      "roiDiameter": {
        "type": "number",
        "default": 12,
        "exclusiveMinimum": 0,
        "title": "Cell diameter (px)"
      },
      "binSize": {
        "type": "integer",
        "default": 5,
        "minimum": 1,
        "title": "Frames per bin"
      },
      "smoothingSigma": {
        "type": "number",
        "default": 20,
        "exclusiveMinimum": 0,
        "title": "Background smoothing (px)"
      },
      "binarizationPercentile": {
        "type": "number",
        "default": 93,
        "minimum": 0,
        "maximum": 100,
        "title": "Threshold percentile"
      },
      "observationsRequired": {
        "type": "integer",
        "default": 2,
        "minimum": 1,
        "title": "Bins a cell must be seen in"
      },
      "maxRois": {
        "type": "integer",
        "default": 1000,
        "minimum": 1,
        "title": "Most ROIs"
      },
      "useShapeDetection": {
        "type": "boolean",
        "default": true,
        "title": "Also find somata by their shape",
        "description": "Find ring-shaped somata (a dark nucleus in a bright ring) in the mean image, as flufinder's shape detection, also those that are never active. They come first, and an activity ROI that overlaps one by more than 75 % is left out."
      },
      "innerRadius": {
        "type": "integer",
        "default": 3,
        "minimum": 1,
        "title": "Nucleus radius (px)"
      },
      "outerRadius": {
        "type": "integer",
        "default": 5,
        "minimum": 2,
        "title": "Soma radius (px)"
      },
      "firstFrame": {
        "type": "integer",
        "default": 1,
        "minimum": 1,
        "title": "First frame",
        "description": "The first frame to process, from 1 (dev's frame interval): the method works on frames firstFrame..lastFrame only, and its outputs have that many frames."
      },
      "lastFrame": {
        "type": "integer",
        "default": 0,
        "minimum": 0,
        "title": "Last frame",
        "description": "The last frame to process; 0 for the last frame of the stack."
      },
      "channel": {
        "type": "integer",
        "default": 1,
        "minimum": 1,
        "title": "Channel",
        "description": "Of a stack with channels (height x width x channels x frames): the one to use, from 1"
      },
      "plane": {
        "type": "integer",
        "default": 1,
        "minimum": 0,
        "title": "Plane",
        "description": "Of a stack with planes (height x width x channels x planes x frames): the one to use, from 1, or 0 for every plane, one after the other, in one run"
      }
    }
  }
}
